{
  "evidence_id": "ev-01a2b3c4-d5e6-4f70-8192-a3b4c5d6e7f8",
  "session_id": "sess-9e8d7c6b-5a49-4382-b716-05f4e3d2c1b0",
  "capability_id": "terraform.generate",
  "schema_valid": true,
  "tests_passed": true,
  "artifact_hashes": {
    "main.tf": "9b74c9897bac770ffc029102a200c5de1a367fd35ff223895b4a1176b866e307",
    "variables.tf": "3f79bb7b435b05321651daefd374cdc681dc06faa65e374e38337b88ca046dea",
    "outputs.tf": "e3b0c44298fc1c149afbf4c8996fb92427ae41e4649b934ca495991b7852b855"
  },
  "created_at": "2026-07-14T10:04:51Z"
}
